datetime,title,selftext,subreddit,created_utc,author,num_comments,score,domain
2021-08-01 17:04:29,Got into a heavily guarded United Nations refugee camp by .... walking in.,"I was inspired to write this story after reading [this story](https://www.reddit.com/r/MaliciousCompliance/comments/ovy80b/underage_teenager_gets_into_an_r_rated_movie_by/)...

The year is 1999. The former country of Yugoslavia has fallen apart and Kosovo is fighting for independence. I have family living in Kosovo and they have fled to neighboring Macedonia. The United Nations has housed them in a large refugee camp outside of Macedonia's capital, Skopje.

My father (who was born there) had lots of relatives in the camp. Brothers with their entire family and a number of cousins. We traveled there together after his employer of 25 years, in an awesome act of support, gave him $20,000 cash, tickets, and a phone number to call if he needed more help.

After 2 days of travel we arrive at the camp, only to be turned away: family members could not access it without a letter from the Red Cross. It turns out that the camp was more like a prison. Nobody could get in or out without authorization, presumably to prevent bad guys from coming in. We go to Skopje and get the letter. Except: only one person was allowed in.

My father goes in and I wait outside. While I'm waiting, I see tons of people walking in and out, flashing nothing more than a badge. Some are UN, some are local Red Cross, some or vendors. This is when I hatch my plan. At the time, the country we lived in issued personal ID cards which were semi-floppy laminated cards, about the size of two credit cards. I walked back to the car and retrieved the lanyard that I use for my work badge. I put my ID on there and in the distance I wait for a shift change.

After the shift change, I simply walked straight through the gate while flashing my ID. The guarding soldiers had no clue whatsoever and didn't even blink an eye.

I found my dad and the rest of the family, and a few days later we had almost 30 family members on a refugee flight for temporary asylum. They returned after two years and Kosovo is now an independent country.",MaliciousCompliance,1627859069,a56-7w,0,1,self-post
2021-08-01 16:41:19,My boss wants to work all his employees 14+ hours a day cause he can’t keep anyone around? Ok then,"Super short and sweet post, my boss has serious trouble keeping employees. Any new person he hires, he makes them work 6 days a week, 10+ hours a day. Most don’t make it a month because of this. So recently we had a severe lack of employees and all employees had 0% morale so what we do have was going very slow. So that made brought us to easily working 14-16 hours a day. So me, and 2 other senior people just quit on the spot. Now he’s gonna get fired cause the entire warehouse is going up in flames struggling to keep up with demand.",MaliciousCompliance,1627857679,LoanSurviver101,0,1,self-post
2021-08-01 15:02:25,Staff buying anything to eat must get receipt signed and tape to product..,"I was the assistant manager in a discount retailer.  

Every few days, someone in corporate would come up with an idea, designed to look good on paper in an office somewhere I'm sure, maybe a beautiful PowerPoint display or an Excel sheet loaded with formulas, all fantastic in theory, but painful to implement in real life.

On this day, an email came, basically that from here forward, anything purchased by staff that was going to be in the staff area would have to have a manager signed till receipt attached.  There would be 2 days grace and then anything found on the next area manager call would be noted and binned immediately.  So regardless if this was a sandwich and a drink for lunch, jar of coffee or a full shop it would be binned.  Cameras everywhere except the toilet cubicles wasn't enough, let's let these guys on a pittance know we trust them less than Chris Chan in an old folks home.  I didn't know what Chris Chan was this morning.  I wish I didn't know now. 

The company, unable to hold manager's,  were on a huge recruitment drive, rather than promote from within, they decided to promote from outside to fill the positions faster.  So my store gets a new store manager, with limited previous experience and out to make his name in the company.  Immediately he hits the canteen, bins everything with no receipt, everything, food and non food.  He doesn't give a crap.  The staff are pissed. Word travels fast.



 Now I've paid my dues between the on trade and retail.  I started at the bottom, sorting bottles for recycling as a kid. And i know enough to know that, I, and my collegues are only numbers in the corporate machine.  Disposable, replacable, an necessary inconvenience that is to be treated as such and never to be treated as equal to the customer even when they are the customer.

Corporate never considered for a moment just how much the staff spent. 45-50 people throughout the week supplementing the sales.  Understand that when someone is on a timed break, remembering the receipt is not a priority, and then  trying to find a manager to sign it, I know I'd often be in the cash office counting tills, and company policy didn't let you leave that room in the middle of a count with a safe open. So by the time a signature was obtained a fair chunk of your 15 or 30mon break was gone, and at your own expense. And this applied to me aswell. I was expected to get whoever was on with me to sign my receipts.

I had a very quick meeting with everyone I'd see over the next few days explaining this new piece of stupidity, and why there coffee, sugar, etc had vanished and that it was entirely the new guy. I also pointed out, very clearly, that Anything purchased in the major retailer directly opposite was outside of the scope of our employer, and could not be touched, and needed no receipts, or proof of any kind. And if it was touched I would report it directly to the highest available person I could get, bypassing the area management.

It took 3 weeks before the call came.  In that time we Stuck to the rules to the letter. The store was down on its week on week figure against last year for the last couple of weeks by a few hundred.  Guess why?

Area manager arrives to investigate how the new store manager is letting the figures slip. Pulls me aside and says what the funk is happening with this drop off?? I explain what happened how all the staff food and stuff was tossed out with no concern, and how with this situation the only option is to shop elsewhere.  

He looks shocked like,  how could these idiots do this?  He goes off on his phone.  Comes back, calls me and new guy into office. Says unofficially revert to normal, this is the only blip in my area, get these figure right for next week.

It was too late to fix the next week but within 2 weeks we were OK and new guy was seen as the saviour and got a move to a brand new store and lasted a month before his team turned on him. End.

Is this maliciously compliant enough? I dont even know.",MaliciousCompliance,1627851745,q2005,0,1,self-post
2021-08-01 13:09:22,Underage Teenager Gets Into an R rated movie by showing me his ID,"I was once the victim of, what I assume, to be malicious compliance.

This happened to me a few years back. I used to work at my local movie theater. One of our jobs was to tear people's tickets, and direct them to the correct theater (shifts for this lasted like 7-8 hours, so yeah it was pretty dull but whatever).

Our theater also had ticket kiosks where you could purchase tickets at a machine. When printed, these tickets are clearly marked and labelled as kiosk tickets. The reason for this is because if someone purchases tickets for an R rated movie we're supposed to check their ID if they look like they're under 25. And the ticket tearer is trained to ask those who look like they might be underage for their IDs if they purchased their ticket at a Kiosk and not at the Box Office. I've had many, many cases where underage kids thought they were just so smart to purchase tickets for R rated films at a machine and bypass the worker at the box office, without realizing there was no way they could bypass the ticket-tearer (when that happened, I usually radioed for a manager, who would refund them the money).

Anyway this happened on a relatively lazy weekday afternoon. Two teenagers (a boy and a girl who I assume were on a date) walked up to me. The guy handed me the two tickets. I glance at it and… yep, it's a Kiosk ticket for an R rated movie (I forget which one).

Me: Can I see your IDs?

Guy: Of course!

Without the slightest bit of hesitation in his motions, he smoothly hands me both of their IDs.

I glance at them, tear the tickets, hand everything back to them, and direct them to the correct auditorium. They thank me and walk past me.

So you're probably wondering, why exactly is this MC?

Well, after the kid and his girlfriend had made their way inside, my brain finally caught up with what the date on the Driver's Licenses had actually said, and it hit me like Ivan Drago; the kid and his date were 16, not 17. This kid had managed to smooth-talk his way into seeing an R rated film, by doing exactly what he was told; showing me their IDs. And since he'd done so with the utmost confidence and without an iota of a hint that he had anything to hide, I had barely gave the birthdates a second thought. I'd been played.

I could've radioed for a manager to kick them out, but honestly I was just too impressed by the balls on that kid, so I let this one slide.

Honestly, I think that kid is going places.",MaliciousCompliance,1627844962,jsrrayburn,0,1,self-post
2021-08-01 12:56:17,"You don’t want to help me? Ok, maybe the CEO can!",[removed],MaliciousCompliance,1627844177,Own_Professor4018,0,1,self-post
2021-08-01 12:45:43,You can’t help me? Ok! Maybe the CEO can!,[removed],MaliciousCompliance,1627843543,Own_Professor4018,0,1,self-post
2021-08-01 12:35:02,My daughter pretending she didn’t hear me so she could swear more.,"Me and my daughter, aged 9, have a rule that if I ever say a bad word in conversation to her, she’s allowed to say that word, and she sometimes saves them to use later. I rarely swear, and never say any really bad words in front of her, we’re talking “piss”, “bitch” and “dickhead”.

She kept trying to find ways to get me to swear at her, by calling me “little boobs” hoping I would tell her to piss off (I would never say it aggressive, more joking back with her and she knows this). But it wasn’t working.

So the other week, it was the night before her school trip, and I checked the weather and said, “it’s going to be pissing it down all day tomorrow” (British term for raining heavily). She looks up and says, “What?” So I repeat myself. She just looks at me, says “what?” again, so I repeat myself louder. Then she starts laughing and says, “Yes! I got three swear words now!”",MaliciousCompliance,1627842902,kwnofprocrastination,0,1,self-post
2021-08-01 12:12:53,So you want strict adherence to the city By Laws? ... You got it neighbour!,[removed],MaliciousCompliance,1627841573,Grabba-The-Butt,0,1,self-post
2021-08-01 11:42:21,"$50,000 collector car is an ""eyesore"" to HOA","Okay, so i've been dealing with this for the last three months and it has FINALLY reached it's climax. for a little back story; I own a towing company and am currently renting a home within an HOA i was NOT informed of when i signed the lease. My wife and i broke ground on our dream home days before lockdown went into effect last year. we signed a two year lease as we were offered a $250 reduction in rent if we did. the house has a three car garage attached to it, as well as parking for an additional two cars in the driveway. i keep my tow truck in the driveway or parked on the street in front of the house as it is classified as an ""emergency vehicle"" by the state and not merely a commercial vehicle. this means it is not against the HOA to have it in the neighborhood. we also own many cars as all three people living in the home are car nuts. now we do not keep that all at the home but we do have a total of 6 cars at the home, plus the tow truck which means two vehicles are always parked on the street. for reference the cars we keep at the home are 1. 1967 4 door Chevy Impala, 2. 1967 Ford Galaxie, 3. 1993 Mazda Rx-7, 4. 1994 Nissan Silvia, 5. 2013 Subaru BRZ, 6. 2008 BMW M3. of these cars all of the imports have wide body kits that cost between 4 and 12 grand. (this is important as to value of vehicles as well as looks.) look up rocket bunny and liberty walk to get an idea of what they look like.  


okay now for the story, after living here for just over 9 months and as the lockdowns were ending/the world opened it's weary eyes just to get punched in the face again the HOA that we had absolutely no idea existed started by ticketing the tow truck which is parked on the street stating that it cannot be parked on the street. okay, i'll put it in the driveway no problem. pay the $150 fine to the HOA after getting the contract from the landlord and reading it, i figure it's best to just go along with it and not ruffle any feathers. by moving the tow truck into the driveway i started parking the RX7 on the streets. here is a  [photo](https://i.pinimg.com/originals/19/fb/ec/19fbec9ed8a80677bf4eb757c826a05c.jpg) of what the car looks like from the company page. (now the reason i listed the other cars) the two classic cars are kept in the garage, as well as the BRZ as it is my project car and i'm in the middle of building a very high end drift car out of it. the other two people in my house drive the BMW and Nissan every day.)  


the very next day i return home and there are tickets on both the RX7 and the Silvia which are parked on the street by our driveway, numerous neighbors are also parked on the street mind you without tickets from the HOA. i immediately call the a-hole in ""charge"" of the HOA to ask what the hell is going on. AH (a-hole) tells me that our ""junk"" is devaluing the neighborhood and cannot be parked on the streets and cites a rule in the HOA guidelines about vehicles being in disrepair or essentially a junk status needing to be put in a garage. i laughed, full on gut chuckle. the guy i'm talking to drives an early 2000's Cadillac that may be worth 10k. AH tells me that if the vehicles continue to be parked on the street he will have them towed.  okay lets play, i told AH that he needs to read his own manual and look at the vehicles he is talking about which for reference here is an image of a matching [Silvia](https://i.redd.it/zd7n6yxirpl51.jpg) which is also parked on the street. clearly both cars  are not in disarray.  


AH 10 days after the intial ticketing calls for a tow truck and this is where i should mention that the reason my tow truck is listed as an emergency vehicle is because my company has the county police contract for their towing, as well as the township. when small-guy towing (SG) shows up to impound my vehicles i am not home, i get a call from SG that he has been sent to impound my cars. (we know each other from the businesses we operate and i often kick him work when we are holding over a 90 minute ETA to not upset customers.)  


SG tells me that he HAS to tow my cars due to his contract with the HOA but he doesn't have a truck that can tow these lowered cars without damaging them. SG asks me to come home and remove the bumpers so they will go on his truck. i told SG that it wasn't going to happen and i'd hate to look for other-guy towing to send overflow work to while we see how the courts feel about the impounding and potential damages to the cars. SG wisely decides to not tow the vehicles. now this was October of 2020. since then SG has called me dozens of times about AH calling him repeatedly to tow the vehicles, SG telling AH that the only company in the area that can tow these vehicles is my company. FINALLY on july 5th AH calls my company to impound MY cars. okay, no problem. i sent 3 of my guys over in the shop pickup to drive my cars back to the shop where they were parked and kept for the last month. the wife started driving the Impala regularly as it is summer.  


Friday we went to small claims court as i sued the HOA for towing costs $250 per vehicle as well as storage on each vehicle $62 per day each AND an additional $3,000 for inconveniences due to not having the cars for daily transportation. add on an additional $1500 for lawyer fees. after roughly five minutes the judge asks for photos from AH of the cars, AH gives the judge photos. the judge comments on how nice the cars are and they clearly are not in disarry. i thank the judge and ask him if he can see the Cadillac parked on the street way in the background of the photo, as well as the other 5 or 6 cars in frame. the judge affirms this and asks AH about these cars. AH states that they are NOT in violation and even coughs up that the Cadillac is his car.   


the judge smiles a toothy grin and confesses to being a car guy and estimates that each of the two cars that have been impounded are worth 50k each and that AH's Cadillac would clearly be the eyesore of the community. the judge then dismisses the HOA's claims and explicitly tells AH that he is NOT to tow any vehicles out of the neighborhood without police confirmation of their disarray or abandonment. judges goes further and states that the HOA is in violation of the township ordinance as the streets are NOT private streets but belong to the township. the judge then grabs what i assume is a calculator and starts punching away. after about a minute and a half of pure silence the judge looks up and says ""okay, as stated before AH's claim for the HOA has been dismissed, as for u/whipssolo's counter suit i will rule in favor in the amount of $10,100 and $65.50 in court costs to AH's HOA. AH lost his freaking mind. AH went on a rant about communism? and how the judge was the problem with this country and into election conspiracies and every wackjob theory you'd hear from people like Alex Jones. the judge warned AH twice and finally ordered him in contempt and invited him to have a weekend stay on the counties dime at the local jail. AH will be home tonight as the judge set to release him at 6pm. the cars are back in their original spots and i cannot wait for the hand wave and grin as AH comes home this evening.  


TL:DR a-hole HOA attempts to impound vehicles but i am the tow company that does this, loses over 10k in court.",MaliciousCompliance,1627839741,whipssolo,0,1,self-post
2021-08-01 10:55:32,So you want strict adherence to the city By Laws? ... You got it neighbour!,[removed],MaliciousCompliance,1627836932,Grabba-The-Butt,0,1,self-post
2021-08-01 10:31:39,I don't want to.,"So... not exactly Malicious but certainly rigorous compliance.  


I was bout five and was taking piano lessons, i was actually quite enjoying it but hated practicing certain pieces i found rather boring so my piano teacher came up with a wonderful system; Once I could play a piece perfectly (to her satisfaction) I would get a gold star in my book and I would \*never\* have to play the piece again unless ""I wanted to"" (her words) so there was one particular piece I absolutely hated that she knew i was bad at that she made me play pretty much every lesson.  
So; I sat down and I practiced it and i practiced it and I practiced it, until i could play it perfectly, I went back in, played it for her, got my gold star. Felt really proud of what i'd achieved and that i never had to play that awful piece again.  


Guess what happened the very next session?   


She asked me to play the dreaded piece. I refused, she asked why and i told her that she'd said that I never had to play that piece again unless I wanted to and \*I didn't want to.\* She said i was going to sit at that piano until I played it, i told her my mum would be there to pick me up in 10 minutes and i could wait. When my mum got there my teacher called me a rude disrespectful little boy and said she was never teaching me ever again.  


I never did play that piece again.",MaliciousCompliance,1627835499,Broken_drum_64,0,1,self-post
2021-08-01 10:16:33,Don't want to use his stuff? Ok!,[removed],MaliciousCompliance,1627834593,littlesharkieshark,0,1,self-post
2021-08-01 09:34:11,Make Money Online Free Sign up,[removed],MaliciousCompliance,1627832051,zqw004,0,1,self-post
2021-08-01 08:32:02,Company's 4th Prime Directive policy wouldn't let me arrest a corrupt senior employee. Workaround: CEO of the company fired him and it was fair game,[removed],MaliciousCompliance,1627828322,BigBossSnake,0,1,self-post
2021-08-01 07:57:13,Answer the phone with the company name? Can do,"Awhile ago I worked at a video store.
&gt;
Every night I did the 'late list', calling people with overdue movies and games.
&gt;
If they didn't answer the phone I was to always leave voicemail.
&gt;
&gt;What frequently occurred after doing the late list was...
&gt;
*Ring ring*
&gt;
[Video store] this is Nutsaur.""
&gt;
*Click*

*#GRR!*

This happened multiple times every single night.

See, it costs to check a voicemail so I'll just return the call and find out who it was.
&gt;
Why pay to check your voicemail when you could ring back a missed call for free?
&gt;
I don't know if it still costs to check your own voicemail but it did back then. 

That same year I disabled my voicemail for that very reason. Pay to check my own messages? No thanks!
&gt;
But I digress...
&gt;
So I thought okay i'll just answer politely without the company name and maybe they'll stop hanging up on me?
&gt;
Good evening, this is Nutsaur.""
&gt;
""...hello? Who is this?""
&gt;
""This is Nutsaur.""
&gt;
Oh did you call me?""
&gt;
""Yeah I work at [video store] and you've got an overdue rental...""
&gt;
This worked for awhile! 

Until...
&gt;
&gt;""Good evening, this is Nutsaur""
&gt;
""Heeey, Nutsaur. This is [boss]. Uh, make sure you're using the company name when you answer the phone, okay?""
&gt;
Damn. Okay that's a hurdle. I hate answering the phone and being hung up on but my boss will catch me if I only say my name.
&gt;

So how do I stop hang ups but also comply?

You know how annoying it is when you miss a call from a private number? It's annoying because I don't know who it was and I can't call them back...that's it!
&gt;
Time to stare into the abyss!
&gt;
I looked up that I only had to dial four numbers on our landline before calling someone to block our number.
&gt;
Nobody would know who is calling them until they answered or checked the message but technically I was still doing my job.
&gt;
If someone missed the call their cellphone would say 'One missed call from private number - one new voicemail.'
&gt;
Would my boss have approved? Absolutely not. 

If he ever found out he would have told me to stop because lots of people don't answer private numbers.

If they didn't take the call or check the voicemail they didn't get the reminder but I *had* called and left a message so technically I had completed my task.

This way the late list got done, I answered the phone properly, and nobody called and hung up on me ever again.",MaliciousCompliance,1627826233,nutsaur,0,1,self-post
2021-08-01 06:01:07,Patient wants what he wants so I just need to shut up and give it to him. Ok,"Patient comes into my pharmacy. “I’m here for my covid test appointment” (btw please stop coming into our store without a mask if you think you may have covid. We have a drive thru)
“I’m sorry you must be mistaken, we only do the tests on Tuesday’s and Thursday’s because of our lab delivery system.”
“No I signed up for the test!”
Proceeds to show me forms for the antibody test. I explained to him that this isn’t a covid test it’s for antibodies and it won’t tell him if he at that present moment has the virus. He tells me he needs a negative result for his sons soccer camp so we need to just do it. Manager steps in and reminds him this isn’t the same thing. Patient starts getting mad and interrupts manager to say “look, you don’t know what they do and don’t require for my sons camp so just give me the damn test I payed for.” 

K. We do the test.
While waiting for the results, patient walks around the store, and my manager calls the soccer camp registration manager, his friend, and confirms with him the antibody test won’t work for them. Camp check in is in an hour. 

Patient comes back, we let him see his results, ring him up, give him his receipt, then manager proceeds to tell him about conversation with soccer manager. Patient is pissed and yelling he wants a refund and we tricked him.

Manager: “no sir, I tried to explain the difference to you and you told us to give you what you paid for, so we did. Your lack of understanding is not our fault and we are not responsible to pay for that.”

I fucking love my job, but a big shout out to my manager who has zero patience for Karens.",MaliciousCompliance,1627819267,CSPhCT,0,1,self-post
2021-08-01 04:23:21,"Boss tells me to change departments? Ok, I'll change my job.",[removed],MaliciousCompliance,1627813401,Justanerd582,0,1,self-post
2021-08-01 02:45:35,"Socially ostracize all people that don’t take an experimental Non-FDA approved vaccination, by “letting it run its course”?",[removed],MaliciousCompliance,1627807535,mathzak,0,1,self-post
