datetime,title,selftext,subreddit,created_utc,author,num_comments,score,domain
2021-08-01 00:42:46,You put all of those in your mouth or you can’t have desert!,"According to my Mother, this happened when I was two years old. The year was, well let’s just say mid to late 1950’s.

Mom, Dad and I were eating dinner and Mom had made a desert of which I was very fond.

I ate most of my meal and told my Dad I was ready for dessert. 

Dad looked at my plate and informed me that I still had five brussel sprouts on my plate and that I had to put them all in my mouth before I could have my dessert.

Understand that I liked and still like brussel sprouts.

I put each of the brussel sprouts into my mouth. Upon seeing this my Dad said I could have my desert. 

When my dessert was placed in front of me I removed all five sprouts from my mouth and placed them on the plate.

My Dad was upset and told me I had to eat the sprouts before I could eat the dessert.

My Mom reminded him that he told me to put them in my mouth. There had been nothing said about eating them.

I got my dessert.  I did eat the brussel sprouts after I ate the dessert, but it was my choice.",MaliciousCompliance,1627800166,SimRayB,0,1,self-post
2021-08-01 00:21:24,"""Personal responsibility""? Ok!","I've been doing all my shopping online, from groceries to clothes everything which means I usually get a lot of deliveries. I also buy a lot of stuff for my family to use, esp when groceries and basic necessities. I started buying from more small local businesses, it being the pandemic and me wanting to help them more instead of big businesses like Amazon. This has meant having to deal with incredibly vague (or straight up wrong) delivery information, I've worked at a small business before so I expected these problems and don't mind it.

Cue few weeks ago. Mom doesn't work anymore, sis is on term break, and I am working from home having a meeting. A delivery comes and no one answers the door, I have my headphones on so i can't hear the bell. The deliveryman calls me and tells me he has been ringing the door and no one is answering even though he can hear the TV. I apologise and run out to collect the parcel, see my mom in front of the tele with so much indifference. This makes me mildly annoyed and I asked her nicely to help open the door next time. Immediately she screams at me for ""assuming she has nothing to do"" which sets off this shouting match between her and I. My sister comes out of her room, takes my mother's side and shouts at me for ""being rude"" just for expecting my mother to answer the door. 

At this point I'm livid and i ask if it's too much to expect my own family to help with these things, esp when im working. They both go on about how it's my ""personal responsibility"" to collect my own deliveries and that i should not ""take for granted"" that they'll help just because they're at home. And that i should tell them when i have deliveries coming, to which i try to explain about the often vague delivery estimates i get (this one in particular was suppose to come 2 days later). 

I point out to them that most of the deliveries that come for me end up being shared by the family (ie the groceries, coffee, necessities etc) and that at the start of the year, before my mom quit her job, i was working from home alone collecting everyone's deliveries even when no one tells me about any incoming ones. I singled out one day my sister had 4 deliveries and i collected them all with no complaints. But obviously none of it gets through to them and I give up the arguement since i was out numbered. 

Bring on the MC. I stopped ordering groceries for the whole family and food runs out, both mom and sis just assume that I would order more and when I don't they question me about it and i tell them that it's their own ""personal responsibility"" to get their own groceries. 

A couple of deliveries came for my sister when she wasn't home and I didn't bother receiving it because the ""personal responsibility"" was hers to collect. Plus, she didn't tell anyone about them. Turns out one of those deliveries was a laptop and because no one answered the door, it was left outside and got stolen. My sister got (rightfully) angry at me and my mother but i used their bullshit ""personal responsibility"" excuse back on her.

Now no one is talking to each other but I don't care, i feel like I've willingly and readily helped them but when i ask for help in return it's way too much for them to do so. This might be petty af but fuck it, it's the card they chose to play.",MaliciousCompliance,1627798884,infiniteknights,0,1,self-post
2021-08-01 00:12:45,"""You can't fire me. But you can make me stop working.""","Many years ago I was working for a fairly large media company that ran TV and radio stations. One of our technical staff, I will call him K, was extremely skilled and reliable but often argumentative and surly. I think he had a right to be, considering his workload and relatively poor wages.

One day a particularly unpleasant member of middle management decided to boss him around and give him extra jobs that he had no right to. In fact, K was not even a member of his department, just an adjacent one that often did overlapping work. After a heated argument the manager loudly fired K in front of all present and told him he would have him escorted from the building if he didn't leave immediately and never come back.

K took this about as well as can be expected and shouted back that the manager had no authority over his department, this would have to be approved by higher ups or at least the manager of Ks own department to be legally binding. The manager repeated his threat and K left the building on his own accord.

Flash forward to a little under a year later and all of Ks duties have been assigned to other people by the middle manager who fired him, increasing people's workload even further. There is talk of union action and work stoppages, union reps have raised a legal fund to sue the company for various infringements against the technical staff. Somehow they are still over budget, despite not having made any new hires.

That's when the manager gets a very unpleasant phone call from his boss, asking if it is true that he told K to never come back to work all those months before. The manager says he did and asks what the problem is. Turns out K was absolutely right and the manager never had any authority to fire him. In fact K had been showing up for work every single day for close to a year only to punch himself into work and then returned at the end of the day to punch out, never entering the building but maintaining his hours and getting receiving full pay.

The manager had apparently sent one informal e-mail to accounting to tell them K was fired but never responded when the accountant asked for confirmation from the relevant department or higher ups. Thus K was still legally employed by the company and received all his pay and benefits for nearly a year while being absent.

That particular manager didn't interact much with staff after that, probably by order.",MaliciousCompliance,1627798365,MorrisonsLament,0,1,self-post
2021-08-01 00:11:01,One more sip…,"So, this just happened. My 3.5yo son is showing signs of tiredness, and he’s just finishing his lunch. As part of lunch, he has a 300ml chocolate milk I picked up from the shops cause it was on clearance, and he’s been a pretty good boy today.

He’d drunk a little under half and was just sipping at it, and I said to him, “ok little man, one more sip then it’s going in the fridge and you’re going for quiet time”

He looks me dead in the eye then fully tries to neck the rest of the bottle!

I let him go until he stopped to breathe, but he definitely has the MC streak!",MaliciousCompliance,1627798261,Erahth,0,1,self-post
2021-07-31 22:47:57,Prime malicious compliance,,MaliciousCompliance,1627793277,RebornDodo,0,1,self-post
2021-07-31 21:33:48,Don't mow so close? You bet!,[removed],MaliciousCompliance,1627788828,cmojave1,0,1,self-post
2021-07-31 21:28:30,We Can't Sit on the Bed together? Ok!,"So I was reminded today of a time Long ago, when my husband and I had started dating. Now my husband and I are Highschool Sweet Hearts, we started dating when I was 16 and he was 18. 

My parents where ok with with us being in my room (second story, at the end of the hall) but they had a rule where we couldn't be on the bed together. I'm not taking the line was under a blanket together, we couldn't even sit with our back against the wall (short side of the bed) next to each other, one person on the bed and the other on the floor. I will note they had no issues with us sitting close to each other in the living room, even with some cuddling or me putting my legs across his lap. I will also add that they had no problem going to bed and letting him leave very late/early hours of the morning, he just couldn't stay over. 

After a few times getting in trouble and being told strictly, we were not allow to be on a bed together in anyway, I mentioned that they were ok with us sitting on the couch, and they said it was different.  

Que Malicious Compliance.

So I took a trip down to my local goodwill and found a really nice double reclining loveseat for $35 . We hauled that heavy mother fucker up the stairs and in to my bedroom, giving me about 2ft of room between my bed and the couch. 

 The nice small size of couch had us much closer then we where sitting on my bed and My parents didn't say a word since it wasn't a bed.",MaliciousCompliance,1627788510,moesickle,0,1,self-post
2021-07-31 19:28:18,"“Don’t come back here until you can afford passage!”? Okay, but we’ll be back sooner than you think.","A lot of this story has been passed down and translated across Italian to English, to whatever version of that my mom speaks, so forgive me ahead of time for any formatting and “lost in translation” moments. Love you Ma.

This is about my great grandparents, Mario and Maria, and their young son Pasquale as they attempt to come to America. My great grandfather and grandmother had been falling on hard times in the early 1900s in Italy, and have been trying for close to two years now to attempt to get tickets to board a ship, any ship, a shoebox, that could get them to America. It wasn’t exactly their lifelong dream, but when Maria got pregnant they made the decision that they needed to go to “freedom”. 

After trying everything, in early 1912 Mario finally decides to just go to the shipyard in gatinava Italy to see what he can drum up. He was hoping to get a ticket by any means possible. The area was absolutely bustling with many people boarding ships, looking around some smiling, some crying. 

He was a very talented carpenter and wanted to see if he could build something for someone. He was even looking on the ground to see if someone dropped a ticket. He was desperate. He finally decides to offer his services or to work on the boat to someone looking like they are an important person about the shipyard. The man turning around, says “You dirty man , I see you running around our ships all day, get out of here!! Don’t come back until you can afford passage!!”

Enter malicious compliance.

As angry as Mario was at this man, he didn’t want to anger the only one (in his eyes at the time) that could stop him from boarding besides money. He went back home, tail between his legs, and kept plugging away in his hometown of somewhere, Northern Italy.

Fast forward to late April, 1912. The titanic sank, the demand for traveling by ship has diminished significantly. He gets tickets for all three to board for like a tenth of the price, and affordable finally. He never saw the guy who insulted him, but he sure was looking as he boarded the ship in a much much less bustling area. 

America, here we come! 

Thanks, great granddad.",MaliciousCompliance,1627781298,Ancient_Educator_76,0,1,self-post
2021-07-31 17:10:16,how i got a pedo and his family kicked out of a water park,[removed],MaliciousCompliance,1627773016,Snoo_57292,0,1,self-post
2021-07-31 16:14:34,"I can't come in today because I'm nauseous? okay, I'll take today and tomorrow off then!","So backstory is that yesterday I was super sick to my stomach all day, on a 5ft chain to the bathroom, the works. I took a little Pepto last night to try and make sure I would sleep through the night, but woke up feeling like shit. 

I knew my work would scramble to cover my shift (customer service) if I called in, and I needed the money, so I called ahead and said ""Hey, I'm feeling kinda sick still, if you guys could keep me mostly at the desk today I'd appreciate it cause idk how my stomach is going to handle things like bagging."" direct supervisor said no problem, but within a few minutes her boss called me up and told me I couldn't just pick and choose where to work for the day, that if I was feeling sick I had to either call out or work any position they needed me in. After like 20 minutes of having a go-around with three different managers, I told them I was going to just call in and go to the urgent care to figure out what was wrong. 

Went in, told the doc what had been going on, and he diagnosed me with viral gastroenteritis, which is a fancy way of saying I have stomach flu. I asked if I should be fine to go back to work, and he told me that the EARLIEST I should go back is Monday, and wrote me a note. With all that in mind, I walked my happy ass from the doctor to my work (like 2-3 miles?) masked up to pick up my prescription, handed them my doctor's note for them to make a photocopy of, grabbed some sick supplies like chicken soup, saltines and applesauce, and grinned under my mask while I heard them scrambling to find someone to cover my shift tomorrow while I walked away.",MaliciousCompliance,1627769674,lepelael,0,1,self-post
2021-07-31 15:52:33,Running the neighbourhood by the city by-laws? OK let’s do that !,[removed],MaliciousCompliance,1627768353,Grabba-The-Butt,0,1,self-post
2021-07-31 14:04:24,Baby bunnies in a bucket,"Before I start here are somethings you need to know
1: This ways years ago
2: The bunnies were fine and we're not harmed and got returned to momma
3: I don't remember how old I was but I was pretty young

Okay now to the story.
My sisters and I were outside play while my parents were in the backyard (we were in the front yard) we ran to our dad and said we found baby bunnies. My dad said to grab them to show him, so we got a bucket and put they babies in the bucket. Both human mom and rabbit mom were mad that we took the babies. We did put them back and they all left.",MaliciousCompliance,1627761864,TheKingofTheNight400,0,1,self-post
2021-07-31 13:32:43,Strict compliance to the ByLaws? You got it neighbour!,[removed],MaliciousCompliance,1627759963,Grabba-The-Butt,0,1,self-post
2021-07-31 12:29:57,The man we called Subsection 6,"This happened long time ago somewhere around 2012-2013.

Had a good friend who I smoke cigars with and he had a friend named Jim. I didn't see Jim very often cuz we lived in different cities but every time I visited we would smoke cigars in the park.

Well, near the park.

Jim was probably about the smartest guy that I've ever met and if I met Einstein it might be eenie meenie miney moe. Well, almost.

We called him Subsection 6 because he was always finding loopholes for absolutely everything. He's the kind of guy that would read all the tax laws and interpretation bulletins and mold his life to that. He was the one of the first people that was working from home. He had his printer in a different room than where he had his office so that he could claim more square footage as the home office. He was that kind of guy.  And he wasn't an accountant or anything. He was an IT guy. He just read lots. 

One day the three of us went down to the beach to smoke cigars. In parks you're not allowed to smoke but we grabbed our chairs and went anyways. The tide was low so we went down just past the rocks where the sand started and smoked away. That's where I heard this story.

So remember Einstein told a story about if he had one hour to solve a problem to save his life he would think of the proper question for 58 minutes?

Well Jim's one of those kind of guys that ask questions that we don't think about. He looked around the park because he was busted one time and he asked himself this question. I can see the property line where the road is, I can see the property line where there's a house next door and he can see the property line where there was a hotel next. But where is the property line when you're looking out at the ocean?  

He did his homework and he found out that while the city owned the foreshore, it was DFO that owns the ocean from the high tide line down. That is crown land and they don't have a prohibition for smoking on the ocean. That is where we had our chairs the day he told me the story.

So he lives in a retirement city with lots of old ladies who have their morning walks the same time he has his morning cigar. That's how he got busted in the first place but he was ready after he did his research. He used that printer that was in the other room and he printed out the laws. He also made a phone call to one of his cigar buddies who was a lawyer who knew a lawyer that did property stuff. I'm not talking about real estate transactions when you buy a house I'm talking about property rights, air rights, things like that. A lot higher up in the food chain. Top floor corner office kind of guy.

So depending on cigar you're looking at 45 minutes to smoke a robusto to an hour and a half for a Churchill or anything bigger than that. Soon thereafter the Karens came by complaining about him smoking in the park even though he was in the ocean. This was even years before anyone was called Karen!

So the Karens started bugging him and threatened to call police or bylaw and he told them to go ahead. He just started his cigar so he had plenty of time. He sent a message to his lawyer friend of a friend to give him a heads up he might be calling later. No problem.

Well the Karen's didn't just call bylaw they called the police.  So Jim continued smoking a cigar while he handed over the printout regarding foreshore ownership. It's not fault of the police because they're used to speeding and stuff like that but they didn't know this law.

Bylaw comes by and pretty much the same so he gets on his phone shows them the lawyers website, and makes the call.  Meanwhile the cops and bylaw are phoning their supervisors about this as well.

Of course the Karens are not happy so they start complaining about the second hand smoke but they don't have any legal basis. 

Jim talks to the property rights lawyer on speakerphone and he says for the police and bylaw supervisors to give him a shout and he will enlighten them about where park property begin and end.

And of course the best part of the story is that we were smoking a 10 year old Punch Churchill when he told me the story. 

So the epilogue is that whenever he's smoking at low tide and bylaw comes by (not just for him but for dogs and drinking and other stuff like that) they always shake their head and wave. They told him they've had complaints about him smoking in the park and they now ask where is the guy? In the park or down on the sand? 

Because the sand isn't park. It's the ocean.",MaliciousCompliance,1627756197,RecommendationNo191,0,1,self-post
2021-07-31 09:20:45,Doing things for the Major,[removed],MaliciousCompliance,1627744845,raito4764,0,1,self-post
2021-07-31 09:14:28,Another act I recalled from my youth,"Previously, I posted a malicious compliance with my mother.  It got me thinking of a similar one when I was a wee lad.

We were at a favorite restaurant, and the restaurant had Captain's Wafer crackers, which I adore.

I was munching happily, when I received an admonishment from my mother.

""Do not eat that whole cracker,"" or some semblance thereof.

If you know the cracker, there are several rows of perforations, assumably to facilitate cooking.  They are spaced about 1/8"" apart along the length of the cracker.

I took a knife, cut the cracker on one of the ends.   Thusly, I removed a minuscule portion at the perforation row and met my mother's requirements.  I gleefully ate the remainder.

The remainder of the story is lost to history, but the compliance was sound.",MaliciousCompliance,1627744468,shag377,3,1,self-post
2021-07-31 06:59:56,"But Captain, that's no woman","I used to work as an officer in the merchant navy a few years ago.
Life at sea is hard on the crew, some of my colleagues from over countries had six months of rotation, at best. So to say that they miss their families is an understatement. Since we were an all-male crew, most missed woman as well.

The company that I worked for had renewed the policy regarding sexual harrassment, on of the rules was that no pornographic pictures (bikini pictures in this case) were allowed to be on display in the common areas, or anything might be offensive for that sake. As the policy said: ""No sexual display of woman"", or domething along that line..
Fair enough, the crew were ok with this and all offensive pictures were removed.

A week later on we had a ship meeting in the mess, the Captain then questions the crew, as to why the picture of the barely dressed woman was removed in the computer room, only to be replaced with another picture of a woman in an itsy-bitsy bikini.

All of the crewmen smirked, one of them looked the captain dead in they eyes with a big smile and said: ""But Captain, that's no woman"".
The Captain had a good laugh at this.

I changed career a year later, to my knowledge the rule was never altered, and no woman were on display..",MaliciousCompliance,1627736396,bekolsyra,12,1,self-post
2021-07-31 05:11:35,"""I must not be touched by any woman!""","Background: I'm a guy. My line of work includes spending a long amount of time in hospital wards. I am NOT a medical professional, but do have to show up in scrubs anyway, so I often get mistaken for one.

I show up to a night shift in observation unit \[I don't know if that's the correct English term\], when two odd looking Hassidic men almost jump at me, frantically asking ""Are you the night shift nurses? Are you the nightshift nurse?"".

I reply ""No"", and they look disappointed, before going back to room 11. I make eye contact with the evening shift nurse \[who was sitting by the computer, unbothered\], confused, and ask what this was all about.

She explains that the patient in room 11 is the leader of a locally infamous cult, known for being extremely misogynistic, among other things. It happened so that the leader in question also has cancer, and requires blood transfusions. Which he refused to do in the outpatient unit, when offered to him, because literally every single professional there is a woman. So he went to the observation unit instead.

Apparently, he refuses to have any woman touch him or go into the room he's in - he threw a fit when the nurse attempted to just place the transfusion stand in the room. He probably expected that, considering his religious affiliation and status, he'll get a special treatment and get a male nurse or a doctor called from the ER. But the head nurse, when called, instructed not to do that.

So once his refusal was properly documented, then, the nurse showed his two deciples\[?\] the bag, and informed them that the treatment was there, and if they want, they can sign a waiver of liability and administer it themselves. They did. 

The nurse gave them instructions, and informed them that ""I'm right here if you need me for anything""... Then watched them fumble for hours, with the leader yelling at them for being clueless idiots.

The night shift came in 15 minutes later. She couldn't help them either.",MaliciousCompliance,1627729895,With_Trees,574,1,self-post
2021-07-31 04:49:21,Doing things for the Major,[removed],MaliciousCompliance,1627728561,raito4764,0,1,self-post
2021-07-31 00:11:56,I must not tell lies,[removed],MaliciousCompliance,1627711916,CA1112,0,1,self-post
2021-07-31 00:11:41,"TIFU by hiring a male babysitter (15M) for my kid (8M), which ended in my teenage son (16M) finding a ....boyfriend (?)",,MaliciousCompliance,1627711901,madcre,5,1,self-post
2021-07-30 21:06:32,I didn't do my job correctly? Ok then,[removed],MaliciousCompliance,1627700792,Novel_Amphibian,0,1,self-post
