datetime,title,selftext,subreddit,created_utc,author,num_comments,score,domain
2021-07-29 22:54:22,I taught my HOA a lesson on rules and regulations!,"I used to rent a condo in a beautiful beach complex that had an…active HOA board. Each unit had at least one parking spot, but most were not garages. Just car ports. In the front of each spot, you were allowed to keep your bikes locked up. The only problem is security was not ideal so one night, a truck drove in, threw a bunch of bikes in the back, and drove out past the 24 hour security guard. That was a huge issue in itself but people could also just walk in and ride bikes out….

When I moved in, I heard the issues about bike theft so I chose to keep my bikes locked up on my first floor patio. I didn’t think it was an issue since:

1) My patio faced a WALL; and 
2) There was no walkway to go by my place unless you walked on a non-approved dirt path my neighbors and I used to get into our places.

At least I didn’t THINK it was an issue until the HOA said that per the Rules and Regs, bla bla bla, I couldn’t keep anything on my patio that was not on the approved list of general patio items (table, plants, etc.).

I was on good terms with the owners, who passed along the written warnings. They agreed it was fine to keep my bikes there since they would otherwise be stolen. And then I was told I would be fined REAL American money if I didn’t keep my bikes inside or in the car port!

And then…I went litigious and petty on the HOA. I’m an attorney and I knew I could not be the only person who was not following the rules perfectly. I also knew they could not apply the rules unequally to individuals.

So what did I do? If you think I carried the rules around the complex and took photos of every single violation I could find, you are CORRECT!

To name just a few of the 15-20 really dumb violations I found….

1) Blue patio umbrella instead of neutral color? PHOTO
2) Personalized items that were not related to plants (dog statues, wind chimes, personalized college placards in the car ports, etc.)? PHOTO
3) Curtains that were not lined in white, facing the road? PHOTO
4) Gardening tools not inside some type of cabinet? PHOTO

And the pies de resistance (French?):

4) Another bicycle parked on someone’s patio! Mother.fing.PHOTO!!!!

And then I spent over 2 hours at work printing color copies of every single photo violation, organizing the violations into subsections, creating 4 binders for HOA board members to review, and attended the meeting where I was to be fined.

As you can imagine, I was not fined. In fact, I understood there was a discussion on how hard they wanted to push on compliance on these rules. However, I WAS respectfully asked to place a tarp over my bikes so it would be less obvious (finnnneeee….)

I moved out soon after that and thankfully, that was the last I ever dealt with such sophmoric losers. However, I strongly encourage other members of this group to do the same when asked to comply with dumb rules!",MaliciousCompliance,1627620862,sequinhappe,94,1,self-post
2021-07-29 22:16:07,When I got a teacher fired,[removed],MaliciousCompliance,1627618567,Wolf-in-a-pot,0,1,self-post
2021-07-29 16:29:30,How I got out of apartment's lease,"This is actually my friends story, but I couldn't not post it here.

My friend had lived in his apartment complex for a few years and his fiancé and him were in the market of buying a house.  Well, the time came and an opportunity came and they put an offer on a house.  They still had 6 months on their lease and asked the management what their options were.

Management told them, they would have to pay a months rent to break the lease.  He agreed and assumed it would be on his final statement (the following month).  The final statement comes and it's for the remainder of the lease ($10k +).  He told them what he was told and of course ""that isn't their policy so they aren't sure why he would have been told this and he was on the hook for the remainder of the lease.""

He remembered seeing advertisements from his community about a 30 day grace period of backing out a new rental agreement (prior to actually moving in and just securing your spot).  He then asked if the unit got rented out before the end of his old lease if he would still be on the hook.  They told him once it's rented out they will release the charges and he will only be on the hook for one month of rent.

He then asked them for an application and applied to rent the exact same unit, waited for the charge to drop from his balance and cancelled his application.",MaliciousCompliance,1627597770,Phatferd,244,1,self-post
2021-07-29 14:56:20,2nd grade truth or dare,[removed],MaliciousCompliance,1627592180,Freaky1006J,0,1,self-post
2021-07-29 14:04:11,Sergeant learns why no one ticketed certain cars.,[removed],MaliciousCompliance,1627589051,Fields_of_Heather,0,1,self-post
2021-07-29 14:00:14,Officer learns that sometimes it's Not okay to write tickets,[removed],MaliciousCompliance,1627588814,Fields_of_Heather,0,1,self-post
2021-07-29 13:58:48,Officer learns that sometimes it's best Not to ticket cars.,[removed],MaliciousCompliance,1627588728,Fields_of_Heather,0,1,self-post
2021-07-29 13:45:31,Want to change the rules for just me? Good luck with my replacement.,"So this is something that has been building for the last 10 weeks but is just now coming to a head this week. Fair warning, this is going to be winded and long as there is a lot of malicious compliance gradually building up. 

I got a job 4 years ago at a small but successful printing company. Over these last 4 years I worked really hard with the owners to make changes and improvements to the company. I learned to do a lot of the behind the scenes stuff that must employees would not learn or even be given the chance to learn. A lot of what I do, I only know how to do. 

Fast forward from the 4 years of starting to 3 months ago. The owners take everyone out to lunch and announce they are selling the company to one of the other employees so they can retire. They originally approached me with the offer but I declined because this offer came mid-COVID, I didn't want to assume the risk, and was WAAAAY short of the deposit needed for a small business loan. 

At the lunch meeting for the announcement, of course the new soon to be boss says there won't be any changes, blah blah blah the typical new owner taking over BS. 

After the lunch meeting and a little more time passes, the new boss is now in charge and takes her first swing at me. With the previous owner I had my schedule worked out to be a little offset from everyone else in order to do some of the things I needed and to commute to work with reasonable traffic. Well this doesn't fly with the new boss because ""it's not fair to the other employees"" that my schedule is deferent. By the way, the difference was 30 stupid fucking minutes in the most dead part of the day where one person could easily run the whole office. 

Fine. Whatever. Now I'm clocking in and out exactly when the new boss listed and a lot of what I used to do is now getting left undone. 

Second swing. After some more time a new person was hired to take the new boss responsibilities from their old position. Now one of the things I do for the printing company is do a lot of the design for new customers. I'm really good and decently fast at it. Not a brag, just a fact of doing the specific for of design for the company for 4 years. Now the new boss wants the new hire to start doing it because sales aren't what they want them to be and they think it's my design style. At least that was the excuse given to me. Just to satisfy my own curiosity, I go and check the same reports for the month since I am one of free people with access to it. At the time of the excuse, same were up almost 11% from the same time period last that. The following year they were up nearly 6% despite COVID. Again. Fine. Whatever. 

Now the new person knows HOW to do the job, but the lack of experience makes them painfully slow at it. Now on top of my changed schedule and work not being done, the art requests that come in over night are now lucky to go out by 13:00 (1:00 pm). So my curiosity peaks again and tells me to check the same reports again for the time period the new hire has started. To my ABSOLUTE NOT SURPRISE, sales are pretty much dead even and bordering on hitting the red if the trend continues. 

Quick side story. Up until this point my wife had been job hunting. At about this point she got hired with a substantial salary increase. Borderline f*** you money. Your can probably tell where this is headed but let's put a pin in that for a little bit longer. 

Final straw is actually 2 things but they were close together so we'll count it as one. Now with all this the new boss informs me that the vacation time I had prescheduled with the previous owner is not fair either and I have to choose certain dates to take. I then decide to take cancel one of the times I had and none it to the following week and take that off instead. After getting back from vacation, I'm asked about my kids daycare situation. It's early June now. 

Since COVID I had been working from home after lunch to take care of my son since daycares closed for a while. Since vaccine rollouts started, every daycare within 20 miles of my place has a waiting list 3-6 months out and because of the business, is first come first serve. Even if what was a place you were at until the shutdowns. No priority system for anyone.

We luck out and find a place that can have us start August 23rd. I let the new boss know in June this start date. After being asked about it again at the end of July, I reiterate the start date and get meet with silence. The following day I get an email saying that is unacceptable and I either start back full time August 2nd in office or be moved to part time permanent. 

After some math, my wife and I come up with a solution. I respond back and say it's my 2 weeks notice and the final week I will only be part time. Thanks to my wife's new job, we can easily afford one income and I get to be a stay at home dad for a while. 

Now on top of everything else not getting done, the one person who knows most about the company maintenance is leaving and at an accelerated schedule as well and with nowhere near enough time to teach everything or even 20% of what I know to other employees. Since my notice, I haven't even been asked about the million behind the scenes things I do like website updating and what not and I'm not bringing it up unless asked. 

tl;dr be boss thought they could change stuff only for me and no one else and I'd take it. Ended up working down productivity and losing a good worker.",MaliciousCompliance,1627587931,Baaron1688,29,1,self-post
2021-07-29 13:28:46,Karen doesn’t like my behavior towards her out of control dog.,"This happened weeks ago but I’m still steaming, so figured I’d vent here. I was at our local dog park with my very sweet little dog who was frolicking in the distance. I was posted up on a blanket on a small grassy hill watching him, with his treats and water beside me. Some strange dog comes running up to me and starts gulping up all of the water. I don’t mind because it’s hot and this poor dog is obviously very thirsty. I gave him a pat and he must have been thankful because he jumped on me and started trying to lick my face/tackle me. He was sweet but a big dog and I was having trouble getting out from under him without making an embarrassing scene, so I was kindly and gently just trying to push him away. As I lay there, pinned on the ground by this large dog that was being playful but very rough, I hear a woman yell at me and I see her from the corner of my eye come running over, wagging her finger at me. She has the AUDACITY to yell and say “if you’re going to let my dog do that, you need to put on a mask- I don’t want you getting us sick.” I say “I am not letting him do anything, can you please get you dog off of me.” She comes over and pulls her dog off of me and starts to say something else (def not an apology) when I cut her off and say “if you’re going to let your dog in other people’s space, you need to wear a mask. I don’t want you two making ME sick.” She was speechless (one of those people who obviously never had anyone stand up to them because she is so confrontational) and I walked away 💁🏼‍♀️",MaliciousCompliance,1627586926,Brave_SoupDumpling,10,1,self-post
2021-07-29 13:26:53,Change or go home!! Okay!,[removed],MaliciousCompliance,1627586813,german_big_guy,0,1,self-post
2021-07-29 11:48:36,Tell me to write with a clearly bandaged right hand? Ok.,"First time poster here, so I'm not sure if it fits here. English is not my first language, so I might get some things wrong due to translation.

This happened several years ago, back when I was in tenth grade, around 2015 when I was 18 years old(I was held back/had to repeat fourth grade). After a small accident in a P. E. lesson I bruised my right hand's middle finger(luckily it wasn't broken or fractured) and had it and my index finger bandaged rather thick.

Naturally, as I'm right-handed, I couldn't write, let alone hold a freaking pen.

Now, this was done during History, where the whole class was together and we're usually split in half for several other subjects. We had to write a test that day and I informed my teacher, Mrs Grunty(obv fake name), about said issue and she CLEARLY saw said bandage as I rose my hand to show it to her so she couldn't say that I faked it. I don't know why, but I think she hated me, as did most my classmates, but I digress. Then, the following conversation ensued:

Me: Mrs Grunty, I'm sorry, but I can't write! As you can see, my hand is bandaged and I'm--

Grunty: I don't care! Write that test or else you will get an F! And don't even bother to come up with another excuse just so you don't have to do your work! 

Me: (visibly anxious bc she was yelling at me) A-alright...


After a quick moment to calm myself, she had gone back to her desk and I enacted my Malicious compliance.

I put my pen between my thumb and pinky finger, which was very awkward, and wrote in a shaky, slightly painful manner. Everything was still recognizable enough, though. After being done and putting it on her desk after everyone else had finished, she looked at the sheet and then at me.

Grunty: What is this garbage! This looks so sloppy and unclean! You're lucky if I give you an E for that! Your writing usually isn't THAT terrible!

Me: (blank-faced) Well, you DID tell me to write...

She didn't say anything after that and I went back to my desk with a smirk, feeling proud. Later on, I got the result back and it was a B.


So that's my story about how I got some malicious compliance done on a teacher that tried to humiliate me. Sorry for the post being so long. I hope it's complying to the rules of this sub!",MaliciousCompliance,1627580916,Charara999,38,1,self-post
2021-07-29 11:42:46,Well that was stupid,"This is an MC that happened to my friends and I years ago when we were teens.

Cast: Me, Mike (the driver) and Steve

When I was  teen I was what some people might call ""bad"". My friends and I were the ones at school who drank and did illegal substances. My friend Mike had a 1981 Ford LTD he rebuilt from a junkyard. We used it on the back roads because it wasn't street legal. Although there were a couple of times we took it into town for a risk. 

On most of the back roads there was not a lot of houses but one road we used had around 5 or 6 houses. The houses were old farmhouses way back off the road so we decided to play mailbox baseball. Steve was up first and the mailbox he hit was a wooden one that turned to splinters when hit. Next was my turn. I took the metal rod and missed the first box but got the second one. A tin one that flew off the post and was ruined. 

Mike said, "" My turn."" He aimed the car toward the next mailbox and sped up about to ram it with the car. The car hit and spun around. We almost ended up in the ditch. It was pure luck we didn't. The right front fender was folded back like it was opened by a can opener. Lucky it didn't kill the car so we drove away as fast as we could.

The next day we drove that road again just to see the mailbox that took out the car. It was shaped like a lighthouse. Wide at the bottom and tapering to the top with 4 sides. We got out to look at the damage we did to the mailbox. Other than a scuff of blue paint from the car and a couple of boards moved slightly there was zero damage. Looking inside where the wood was pulled away we could see the owned had built the framework for his mailbox and filled the inside with concrete. I think he might have had someone do that to his mailbox before so he ""fixed"" it so it can't happen again.

We picked a different road to play mailbox baseball after that. Mike got another fender from the junkyard and we put it on before going back out though. It is a good thing we used Mike's car. Most of the time I borrowed a car from my parents when we went out driving. I wouldn't be here today writing this if we used one of mom or dad's cars. 

Remember folks; don't drink and drive. And watch out for car killing mailboxes",MaliciousCompliance,1627580566,Dark909911,12,1,self-post
2021-07-29 11:22:00,“Coffee” gets you a coffee,"For 8 years as a flight attendant it didn’t bother me having to ask “cream or sugar?”, but one day it just hit my trigger button.

Now that I’m at 13 years, I’m just handing you a black coffee and moving on with my service.

You don’t make the baristas at Starbucks guess your order…..",MaliciousCompliance,1627579320,FlyChi2020,73,1,self-post
2021-07-29 08:59:35,Unite the animals of the house? Sure,[removed],MaliciousCompliance,1627570775,SaffronCourgette,0,1,self-post
2021-07-29 07:49:09,Being forced to give our notice,[removed],MaliciousCompliance,1627566549,kirajeanirons,0,1,self-post
2021-07-29 04:52:34,Take away my access and make doing my job more difficult? Get ready for your colleagues to hate you for it.,[removed],MaliciousCompliance,1627555954,DattoDoggo,0,1,self-post
2021-07-29 04:36:00,To much pepperoni!!! But you asked for it that way :),[removed],MaliciousCompliance,1627554960,rhunter1980,0,1,self-post
2021-07-29 04:16:56,"Make me come in on a Sunday? Fine, but I'm going to play Monopoly!","Years ago, I worked in the office of a distribution centre for a builders merchant, full of very petty 'us vs. them' types. Every July, there was a summer stock take over the weekend, which was compulsory, but overtime was paid. This consisted of last orders being picked and sent from the warehouse, outstanding  errors etc being cleared off the system in the office on Thursday, count on Friday and Saturday (office staff would join in after a quick refresher on the warehouse management system) then Sunday would be a catch up order picking/sending day so branches would be running as usual on Monday morning. Office staff were not trained/employed for picking, and we weren't needed on the floor. For several years we got away with not having to work on Sunday but one year, the pettiest of the petty women caught wind of us not working on Sunday and went to management to demand that we work it. If everyone has to work all weekend, that should be *everyone*. 

The DC manager told us that we would have to work it, we asked what we were supposed to do. Our job was to answer calls from branches (closed on Sunday), and sort out issues from the day's deliveries (which didn't happen on Sunday). Manager insisted, so we said that we would come in but we were bringing party food and playing Monopoly since there was no work to do. 'Fine, do what you want, as long as you're here and in the office'.

Sunday comes, we stick to our word and have a lovely day playing Monopoly, eating treats, listening to music, I think I'd even brought a portable DVD player and we watched a movie. The onsite HR manager came in at one point and asked us what we were doing so we explained, I could see her mentally calculating how much double time we were getting paid to play board games and she stalked off to shout at the DC manager whilst we were in the clear. 

The following year we didn't have to go in on Sunday, and petty people who moaned were told to mind their own business!",MaliciousCompliance,1627553816,QueenieSimmer,398,1,self-post
2021-07-29 01:43:40,Shall we dance?,[removed],MaliciousCompliance,1627544620,Bass-Ambitious,0,1,self-post
2021-07-29 01:26:03,Make me some food OK SIR NO problem,[removed],MaliciousCompliance,1627543563,littlemissbunnywoman,0,1,self-post
2021-07-29 01:24:51,Make me a sandwich OK SIR (Enjoy the fiery depths of hell),[removed],MaliciousCompliance,1627543491,littlemissbunnywoman,0,1,self-post
2021-07-29 00:51:00,Wanna force teenagers to clean for the night crew? Enjoy a bigger mess than what would have been there.,"So I'm not the proudest of this as there were 3rd parties that got caught in the crossfire, but I was a teenager. 

I worked at a movie theater while in high school, and it was a busy city so we were open pretty late on weekends. Normally as an usher we would clean every theater until the final showing of the night started, which was was usually midnight. My manager had a wonderful idea of how we could help the night crew. We were told we had to stay late(2-3 hours) and wait for the theaters to clear, and grab the big trash to help the night crew, so candy boxes, cups, popcorn buckets etc. 

Queue malicious compliance, they just want the big stuff right? we placed the trash can in the middle of each theater and played trash basketball. Full cup of sprite left behind? Kobe! Popcorn bucket left half full? Shoot it anyway and let the popcorn rain down. Leftover liquor shot bottles, just because they were empty didn't mean we couldn't take a shot, if the big stuff becomes little stuff I guess its not our problem. The state of the theaters was appalling after we followed her instruction.

We never had any blowback, but that manager never closed again, and often worked shifts when the main manager was there. We ended up with the cool 3rd manager that had no shits to give about that place, who just let us be as long as the theaters were clean and we weren't messing with customers too much. We also stopped clocking out and she was too lazy to back date our time cards, so we got paid till 3am anyway.",MaliciousCompliance,1627541460,The_Minshow,4,1,self-post
2021-07-28 21:29:41,Teambuilding activity? I think I'll pass,"I just remembered this story from about 6 years ago. I (11M at the time) was attending band camp with a large number of other kids and we were split into groups to do different activities throughout the day. Each group was about 10-15 kids large I believe. Anyway, my group was designated to go play some outdoor games and teambuilding activities. Everyone in my group knew each other though, so we instead just had fun playing around. The malicious compliance come in during the teambuilding exercise.  Our group leader had us play a game that was basically the floor is lava. We were given a large assortment of things to try and cross the field (lava). Obviously the intention was to have everyone work together to build some sort of bridge across, but we were kids and we wanted to mess with the adults. There were some things like a large rug or a few wooden planks, etc. Everyone tried to have some fun with it, but we all agreed that my idea was the most memorable afterward. One of my friends grabbed the rug and started hopping across the lava. Another few tried various tricks and similar stuff, but no one made it too far without falling (lol). I however saw two frisbees and seized the chance. I put the frisbees under my feet and started scooting towards the other side. My entire group was rolling over laughing, and the team leader was staring at me in disbelief. I proceeded to scoot all the way to the other side while everyone was still at the beginning basically crying with laughter. My team leader was not amused and told me ""you really should try working with the others"". Afterwards I came back and once everyone calmed down we actually completed the challenge in a more traditional fashion, but seeing my group mates like that and the face my team leader made always brings a smile to my face. 

&amp;#x200B;

TD;DR: Team leader wanted us to work together to cross a field without touching it, but I used two frisbees to scoot across instead.",MaliciousCompliance,1627529381,Fugaku_Sanjurokkei,26,1,self-post
2021-07-28 20:20:16,"Karen wanted her special order in 15 minutes, and I put her in her place.",[removed],MaliciousCompliance,1627525216,Bannor21,0,1,self-post
