datetime,title,selftext,subreddit,created_utc,author,num_comments,score,domain
2021-07-30 20:59:44,You want the salted licorice? Sure thing!,"I used to work in a candy store back in highschool, pretty awesome job ngl. We had a pretty huge selection of candies to choose from, including a pay-per-pound candy case that took up most of the store. We sold a decent amount of licorice in different flavors, including salted licorice. If you’re unfamiliar, it’s just black licorice that’s been dusted with powdered salt. We had a few different versions of it, but one stood out for how *damn salty it was.* Seawater is less salty than that licorice. Pure salt is somehow less salty than that licorice. We would always have new employees eat a piece of it as “initiation,” and share a few laughs at their facial expressions after the first bite.

One day an older man comes in and rudely asks where our salted licorice is. I guide him over to the licorice section, and show him the choices we have. He immediately goes for the saltier-than-salt licorice coins. I try my best to dissuade him, explaining that this licorice is extremely salty, but he quickly turns on me.

“Young u/yellowspaces, I’ve been eating salted licorice my entire life. Just shut the hell up and weigh me out a pound so I can get the hell out of your damn store.” 

Cue the malicious compliance! I gladly weigh him up a pound of the salt coins, and take him over to the register. I ring up his devil “candy,” hand him a receipt, and take a step back. Old man starts walking to the door, but luckily takes a piece and pops it in his mouth before leaving. 

“OH MY F****** GOD. WHAT IN THE HELL IS THIS!?!?” he screams after a few chews. The store is now dead silent. He storms back up the register and starts screaming at me. 

“THIS IS THE ABSOLUTE WORST LICORICE I’VE HAD IN MY LIFE! HOW DARE YOU LET ME BUY THIS! GET YOUR F****** MANAGER RIGHT NOW, YOU DESERVE TO BE FIRED FOR SELLING ME THIS!!!” 

Before I can even say a word, my manager quickly comes up to me and motions me aside. 

“Sir, I was listening to your transaction, and u/yellowspaces made multiple attempts to talk you out of your selection. Normally I’d be more than happy to issue you a refund, but considering your language and treatment of my employees, *I’m going to need you to get the hell out and never come back.*” 

Old man was so taken aback that he stormed out with his tail between his legs, and we never saw him again. Turns out the only things saltier than the licorice was his attitude!",MaliciousCompliance,1627700384,yellowspaces,111,1,self-post
2021-07-30 19:35:31,List all family members with “deceased” medical condition? Ok,"Just a short one today, on mobile so all that jazz about formatting.

So I am an incoming graduate student at a big school and a requirement to be in person is to complete a immunization and medical history form. Sounds standard and fair considering the environment we are in. Well on one of the sections it wanted me to list medical conditions of my family members. The exact wording was something like “list medical conditions of your family, mother, father, grandparents, etc.” This makes sense but as I go down one of the conditions is “deceased”. 

Cue the MC. Well I figured I should list all my family members that have this medical condition. That would be my great grandfathers and my great grandmothers. But I should list all 4 of them. Now that I think about also my great great grandfathers and my great great grandmothers have that medical condition. All 8 of them!! Pretty serious stuff. So I went on listing all my family that have this medical condition until I got tired haha. Haven’t heard anything about my MC but I did get my clearance to be on campus so they probably appreciated my thoroughness.",MaliciousCompliance,1627695331,TheMkFlash84,57,1,self-post
2021-07-30 19:00:25,Kill 'em with kindness,"Back in 2019, I started working remotely for an international architecture firm as the project and sales manager. We create architectural renderings, animations,  VR walk-throughs, you name it. Our clients come from all over the world and I manage the North American branch of the company. Our US team is small and comprised of myself and two other women also with backgrounds in architecture. We're lucky to work with a team that is very inclusive and supportive and our clients are great 99% of the time. 

A few months into my new position, we get a phone call from an American developer requesting a rendering package. A team member from our Euro branch answers first and within ten seconds transfers the call to our US team, as per company policy. I answer the phone.

""Hi, you've reached [Our Company], how can we help you?"" 

The caller immediately sounds annoyed, but mumbles: ""I want a drawing done, of a building I'm making."" I respond in my cheerful customer service voice™, ""Sure thing, we can help you with that!"", and I begin listing the design files we will need from him to create a 3D render. He cuts me off a few seconds in, ""You don't know what you're talking about!""

It's not uncommon to deal with annoyed clients. Most people are stressed out with tight deadlines of their own, so I try to be as patient and helpful as possible. I ask the caller, ""Will you please describe your project in detail? That way we can create the best design package for your-"" 
He cuts me off yet again. ""I want to speak to the manager! You have no idea what you're doing!! I want to talk to the MAN who answered the phone.""

At this point I figure out what is going on. I politely explain to him that I am the manager for American projects and the man he briefly spoke with works with our Euro branch, but the caller is just not having it. He yells into the phone: ""I want to speak to an AMERICAN!"" Thank god for volume controls on headsets.

Taking a huge breath, I plaster a smile across my face and explain again in a syrupy sweet tone, ""I completely understand sir, I am the manager for our American branch. I can help you with your project."" My motto is kill 'em with kindness. 

He explodes: ""The man I talked to understood my entire project! You know nothing!"" So begins the death spiral. I decide to agree to everything he says.

*Caller*: ""I want to speak to someone else!""
Me: ""Sure thing! I'll transfer you to our Euro department.""
*Caller*: ""NO. I want to speak to an American!""
Me: ""You got it! How can I help you?""
*Caller*: ""Fine! I want to speak to YOUR boss!""
Me: ""Sure thing! He's in the Euro department, I'll transfer you now.""

I transfer the call to my bosses' office and wait for the inevitable. After a few seconds, my phone rings again with a transfer request. I answer with a grin, ""Hi, you've reached [Our Company], how can we help you?"" 

Dead silence on the line. Then our dear caller huffs ""Fine! I'll call back tomorrow then!""

I cheerfully bid him farewell, ""Okay sounds great, I'll speak to you then!""

*Click*

We never did hear back from him. It's a shame, I really do like helping our clients. 😁",MaliciousCompliance,1627693225,diamondfaces,35,1,self-post
2021-07-30 17:39:20,"Remember, Report Weird Things To The Boss!","Me again, feeling the need to rant about past jobs!

Obligatory disclaimer: this story is old, and I've not worked there for a VERY long time.  If the people in this post recognize the situation, well, it's your own damn fault.

Having gotten that out of the way, to the story!

Fresh out of college, and into the first post-college job.  Now, some of us are very lucky and get to work in a field close to, or in, our chosen realm of expertise right out of college.  I was not one of those lucky people, so I got to work for a popular rental company for a while.  You don't need to know which one.  They're all similarly terrible.

I was given the requisite training (not much), and left to the tender guardianship of someone who'd been there for a few years (ie, work senior).  At first, I thought everything was fine.  Why wouldn't it be fine?  The gal and I seemed to get along well, and the job, while not fun or glamorous, paid me enough for the absolute bare minimum living expenses.  Good thing I was still on the family insurance at the time, because the job, after an attempt or two, refused to hire me full-time so I could get my own insurance.

Anyway.

Like I said, at FIRST, I thought things were fine.  The person who was guiding me gradually started treating me poorly.  I chalked it up to ongoing situations with her private life (she was pregnant, living situation stuff, etc), but as time went on, she kept snubbing me and some others, and wouldn't answer questions.  My last attempt, she just told me, ""look, I don't wanna have to answer your questions anymore.  Just report anything wrong you see to the boss.""

I'm sure you can all see where this is going.

Found out from the boss, that I was getting reported as not working, when I actually was.  I luckily always had witnesses to the fact that I was, in fact, working as hard as I had to be, so nothing really came of it.  *(as an aside, I later learned it had been* ***her*** *starting the rumors of my not being a good worker.  Still don't know why.  I was never anything but pleasant to her)*

In my relative naiveté, I noticed that she was taking a lot more breaks than she was technically allowed, even considering she did have special dispensation because, y'know, pregnant.  More, she started disappearing from the job entirely at strange times, reappearing looking completely innocent and fresh.  Almost like she'd not been working.  Her partner would bring the car around, and she'd take the time to give it a loving wash (which was sometimes allowed).

Thinking it strange, I did what she told me to do.  I reported it to the boss.  I named times, and that I'd seen her partner's car in the bay.  Since I sometimes borrowed my roommate's car, I asked, could I also use the bay to wash it?  Boss looked confused, but said I could wash the car if I wanted and we weren't busy.  

A few days pass, and I notice she's not in.  I ask around and was like, where's she go?  Did something happen with the baby?  Is she okay?

Turns out that my (and I later found out, others) reporting her, and giving times, made the boss decide to check the security cameras.  She and her partner had, among other things, been stealing fuel and other things from the job, and her ass got canned on the relative spot.

I don't think this story has a moral, per se, but I'd say that you shouldn't disdain the source of good advice.  Even if the source was apparently trying to get you fired.",MaliciousCompliance,1627688360,YarnAndMetal,10,1,self-post
2021-07-30 14:29:03,You don’t want my help with your workload? Fine. Get fired instead.,[removed],MaliciousCompliance,1627676943,Electronic_Nebula999,0,1,self-post
2021-07-30 14:23:50,Tell me to host the wedding party? Ok.,"My friend Mabel is getting married but her party venue was closed down due to a water main burst. Her wedding is in three months but she was super desperate so she begged and begged and kept begging so I finally said yes. She wanted the wedding at my chairy farm. I have three farms: a chairy farm, a root farm (onions, beets, tomatoes, etc.), and a miscellaneous one for things like strawberries and carrots and stuff. Two of them are in green houses because of the climate and she wants to have her venue in one of them. I said sure not problem, because I can easily move the trees out of the green house since they usually get stored in my garage during off season. She surprised showed up at my house asking to see the greenhouse but I told her that I can show her but the the chairy trees have thorns and stuff so I told her to be really careful. (I’ve been stuck so bad I’ve had to go to the doctors office because of a tetanus infection from the wound being infected) loe and behold she walks right into one of the fucking tree branches and I have to take her to the hospital because she is allergic to cherries (why would she want to have her venue in the cherry greeenhouse anyways I ask myself??) I got mad at her and told her how upset I was because I felt bad she had a reaction. She was so upset she demanded it be in the greenhouse. To be fare it is in a really scenic area. Here is where the malicious compliance happens:

It is the wedding day so I cart the chairy trees out of the greenhouse but my garage is packed with wedding tables and the cake so I’m like. I can’t put these trees in here so where am I going to put them? So I just decided to have a cherry tree section in the corner of the greenhouse and I bungee corded the branches together so it took up less space. We had the wedding and it was a blast and every one was so happy and I even let people eat the cherries but they weren’t ripe so it was gross but people liked the experience.

Edit: I know how to spell cherries I think spell correct was on acid or something LOL!",MaliciousCompliance,1627676630,BariumSodiumNa,25,1,self-post
2021-07-30 14:17:03,You don’t want my help with your workload? Fine. Get fired instead.,[removed],MaliciousCompliance,1627676223,Electronic_Nebula999,0,1,self-post
2021-07-30 13:53:12,Don’t want this saleswoman? Let me find another for you.,"While I was putting myself through university (this was in the mid 2000s), I was working at a bicycle shop. I can honestly say it’s the best place I have ever worked; the owners treated their staff very well and so this shop retained loyal, highly-capable employees that made loads of high-end sales. But what was somewhat unusual (for a male-dominated industry in the mid 2000s) was that there was an equal number of male and female employees. And these women were definitely the most qualified people for the job. One was an engineer for a bike company, one was a highly successful triathlete and XC racer, and even one of the owners was a woman. *Almost* having an unrelated university degree meant that I was BY FAR the least impressive woman working at this place. I just liked bikes.

One day, a man (maybe 50-60ish) came in to the shop. I was first on the scene. He said he was looking to buy a bike and so I started going through the usual probing questions to determine what kind of bike he was looking for. Simple questions like: did he ride on the road or trails? Even the most incapable salesperson could use the answers to these questions to point this guy in the right direction. But he seemed HIGHLY resistant to talking to me or answering my questions. He finally said, “is there someone else I could talk to?” 

Maybe he just didn’t like my sales approach or maybe I seemed too young to be knowledgeable. But since he didn’t even give me a chance to prove myself, and seemed to be staring longingly at my busy male colleagues, I had a hunch that he didn’t think a woman was capable of selling him a bike. So I smiled and said, “of course!” Lucky for me, there weren’t any idle male employees in sight. So I grabbed one of the other women that I worked with, quietly letting her know my suspicions about this guy. Before I was even out of earshot, I hear this man agitatedly say, “I need someone ELSE”. Suspicions CONFIRMED. So we purposely seek out yet another extremely capable female employee to help this man. When he sees her approach, he shouts, “JUST LET ME SPEAK TO YOUR MANAGER!!!!” 

So in struts the owner, who is *very* eager to join our malicious compliance stunt, with a beaming smile on HER face. “I’m the owner. What can I do to help you today, sir?” The utter defeat on his face is something I will never forget.",MaliciousCompliance,1627674792,BreWanKenobi,790,1,self-post
2021-07-30 13:47:39,Make you a sandwich? Ok,"After about 100 comments from other subs saying oh post it here post it here post it here is buckled and I am posting this story on pettyrevengr 

So, since I adopted my kid she's been having lots and lots of friends come around and of course that means I am getting to meet the parents. So far I have met 5 of Ks Friends Parents most of which have been Lovely people and one I absolutely hate there was another set of parents that we got off on the wrong foot (accidental racisms from them) and I recently had we will say umm ""pleasure"" of meeting Ks friend Ashly's father Her parents are

well Yah lets get on with Bunny story time.

K had her friend Ashly over for the night and it makes me happy K has really opened up in the last few months and is growing into the confident friendly Bubbly Joyful person

Well the day after I didn't know it was Ashly's fathers day with her so he came to my house to pick her up. The girls weren't ready to leave yet they still had to pick As clothing up and pack so instead of making the father wait out in his car I told them that they will still be a few min and he's welcome to come inside and wait.

I went ahead and tried to make the usual small talk, but was instantly getting the creeper vibes off this guy mostly because the line of questioning and phrasing he was giving and using. it was allot of do you live here alone all by your self this is a terribly big place for such a small little girl (referring to me as a little girl) or (Oh, I should come to visit you sometime your place can use a mans touch) he basically treated my house as if it was his and just creeped on me big time.

Well, this guy decided to literally tell me that oh go make me a sandwich for the road, he didn't say hey, I haven't had anything to eat yet was not polite at all the assholes demanded food from a stranger he just met while waiting for his kid.

I thought he was making a bad joke I said my English is not that good are you making a joke and he flat out said no I am hungry, go grab me a sandwich doll at this point I am pissed off this literally is the most mysognistic man I have ever met in my life and I was pissed off Did I say I was pissed off because I was pissed off like PISSED

so I did it I put on my friendly submissive Asian lady smile and said ok Sir.

and i went to the kitchen got out some really good roast beef (it was from dinner a few days ago) and really nice French bread and made him a nice sandwich.

I did add a healthy amount of ground Szechuan Peppercorns a nice glob of Ghost pepper extract sauce (I use it for making super spicy chili) white pepper and a fine spread of minced scotch bonnet peppers.

packed it in a baggy and lucky the girls were ready to go as I packed the sandwich

I handed it to him with a big smile and have a NICE day SIR as he walked out the door.

I did immediately tell K to text her friend to not eat the sandwich and told her what was happening.

later that day Ashly called K to say what did you do to my dad (she was cry laughing on the call)

Edit: just for an FYI this was weapons grade spicy and it was a smoked brisket. I used the juice from the brisket I saved to hide allot of the spicy smell",MaliciousCompliance,1627674459,No-Cartoonist-2079,1,1,self-post
2021-07-30 13:40:14,Ex-Boss asked me for a shoutout due to some of my music getting local media attention ...,"When I found myself jobless I took a chance on my hobby : writing music ... After a lifetime of being told I didn't have the voice or the guitar chops one of my song was picked up by an amazing film-maker, 4 Festival selections and thousands of streams later I get tagged in a facebook post by local media asking if they could do a story on me !  My ex-boss immediately messages me asking for a 'shout out' and even asks some of my ex-coworkers to come over as he wants to see them 'text me and ask for specific store shoutouts' 

So I decided to agree, told everyone to watch, I'll then proceed to tell everyone watching that regardless of where you work, now is the time to ask for a raise due to the worker shortage hitting Montreal.

If you're out there reading this, ASK FOR A RAISE.",MaliciousCompliance,1627674014,PurveyorOfSapristi,8,1,self-post
2021-07-30 13:25:54,Jeans are against the dress code now?,"Like many stories I've read here I'm not entirely sure if this belongs here either but figured it's a story worth telling anyway.

So this happened more than a few years ago at a premium retailer I used to work for. The stores were locally owned and the atmosphere was casual but professional- this included being allowed to wear jeans. We had about 6 stores around town and I was in the position of support bouncing around from store to store. 
I also never sold anything my customers didn't need. The owner didn't care because I was there to support his stores and my quality was really high but eventually he was forced to sell to a much larger chain and the new guys were known to have strict sales quotas. So you can see my not selling crap was a huge no no. 

Now the MC: the new guys forced me into a store and cut off the bouncing around, they also changed our dress code to wear slacks instead of jeans and trained us on our new (their) corporate policies. Most of us were fine with this but I wasn't, we live in a very hot climate and jeans are much more comfortable. The new district manager started noticing I wasn't meeting my sales quotas which my store Manager knew. He pointed out my metrics were still high but the new boss didn't care because I wasn't peddling his crap. They decided to invectivize us with a sales contest, winner gets to wear jeans again that following Friday, we just had to meet the sales quota. My manager knew I would refuse but chose to play along anyway to please the dm. 

That following Friday I walked in wearing jeans. My manager knew why but just shook his head and laughed to himself. When the DM decided to grace us with his presence later that day he saw me in jeans then went into the back to check the numbers. He went ballistic and called me into the back. He berated me for not following policy and daring to wear jeans when I didn't meet the sales quota, blah blah blah. I just smiled which really pissed him off then happily pointed to the calendar and their policy: it was Halloween and I was allowed to dress up however I fucking pleased. He turned red but couldn't refute this fact. My manager was at the front listening to every word trying not to laugh (he didn't like the new bosses anymore than the rest of us) and the rest of my team got a real kick out of my non compliance after the DM left. 

That guy turned out to be even more if a dick than I originally thought and ended up harassing us into quitting a few months later, fortunately I already had a new job lined up. Still, fuck petty managers and their power trips.",MaliciousCompliance,1627673154,Able_Engine_9515,24,1,self-post
2021-07-30 11:03:20,"You want to call the owner? Ok, you do that",[removed],MaliciousCompliance,1627664600,AltAcctThrow,0,1,self-post
2021-07-30 09:56:13,"""You don't have to show the process"" so I started to Photoshop everything.","I am doing a report right now. Let's just say it's has a lot of pictures of the office to show that it's a good environment.

The so-called head of the project whom I do not answer directly to but who has started to order me around reviewed our dratf of report and she had so many complaints about it even though it was done almost perfectly by our team.

She started to criticize our very much detailed description on everything (which usually will get you  higher marks with the panel juries, she's not one of them) and one of her comments was 'you're showing too much cooperation and team work', 'we don't need to see the step-by-step' and 'it's too comprehensive' and 'take out all of these things and make it simpler'.

Since we don't need to show that we're doing honest work, I am starting to Photoshop everything just to show the end result.  


Dirt? Photoshopped instead of cleaned.

Wrong signs? Photoshopped instead of changed.

Typo in labels? Corrected with Photoshop.

Worn things that should be changed? Good as new with tone &amp; contrast function.

Rubbish in photos? Magically erased.

Why would you be critical when someone goes the extra mile in reports?

Could it be that her own office branch is also competing in having the best report?

It's okay it's easier this way.",MaliciousCompliance,1627660573,lilycalico,38,1,self-post
